{
    "format": "vrlearn-scenario",
    "version": 1,
    "id": "builtin-05",
    "name": "交差点：うしろから曲がってくる車",
    "nameEn": "Car turning from behind",
    "setting": "crossing",
    "learningGoal": "曲がってくる車はうしろから来る。渡る前にうしろも確かめる。",
    "situation": "橋の側から交差点を渡っているとき、うしろ（橋の方）から左に曲がってきた車とぶつかりました。",
    "point": "渡る前に振り返って、うしろから曲がってくる車がいないか確かめましょう。",
    "map": "hikone-kyobashi",
    "playerMode": "walking",
    "spawn": {
        "x": 38.94,
        "z": 35.94
    },
    "goal": {
        "x": 40.0,
        "z": 17.0,
        "width": 5.06,
        "depth": 1.0,
        "yaw": 180.0
    },
    "trigger": {
        "x": 40.0,
        "z": 30.2,
        "width": 4.95,
        "depth": 4.88,
        "yaw": 0.0
    },
    "vehicles": [
        {
            "name": "車の流れ Left2",
            "model": "Car_Left",
            "route": [
                {
                    "x": 7.16,
                    "z": -3.72
                },
                {
                    "x": 21.63,
                    "z": -3.74
                },
                {
                    "x": 29.92,
                    "z": 4.36
                },
                {
                    "x": 29.9,
                    "z": 49.47
                },
                {
                    "x": 35.88,
                    "z": 62.26
                },
                {
                    "x": 46.1,
                    "z": 64.7
                },
                {
                    "x": 54.9,
                    "z": 64.7
                }
            ],
            "speedKmh": 36.0,
            "start": "begin",
            "delaySeconds": 5.0,
            "repeatMinSeconds": 4.0,
            "repeatMaxSeconds": 6.0,
            "stopOnTrigger": false,
            "accident": false,
            "overrideYaw": true,
            "yaw": 90.0
        },
        {
            "name": "車の流れ Right2",
            "model": "Car_Right",
            "route": [
                {
                    "x": 52.87,
                    "z": 60.39
                },
                {
                    "x": 44.52,
                    "z": 60.47
                },
                {
                    "x": 40.33,
                    "z": 59.3
                },
                {
                    "x": 34.5,
                    "z": 52.7
                },
                {
                    "x": 33.89,
                    "z": 6.33
                },
                {
                    "x": 26.15,
                    "z": -6.85
                },
                {
                    "x": 6.2,
                    "z": -8.15
                }
            ],
            "speedKmh": 36.0,
            "start": "begin",
            "delaySeconds": 5.0,
            "repeatMinSeconds": 4.0,
            "repeatMaxSeconds": 6.0,
            "stopOnTrigger": true,
            "accident": false,
            "overrideYaw": true,
            "yaw": -90.0
        },
        {
            "name": "事故車 1",
            "model": "Car_Left",
            "route": [
                {
                    "x": 34.58,
                    "z": 46.1
                },
                {
                    "x": 34.7,
                    "z": 34.73
                },
                {
                    "x": 36.72,
                    "z": 29.97
                },
                {
                    "x": 39.76,
                    "z": 28.35
                },
                {
                    "x": 42.49,
                    "z": 28.0
                },
                {
                    "x": 51.05,
                    "z": 28.0
                },
                {
                    "x": 80.51,
                    "z": 27.97
                },
                {
                    "x": 93.67,
                    "z": 17.92
                },
                {
                    "x": 94.36,
                    "z": 0.72
                }
            ],
            "speedKmh": 36.0,
            "start": "trigger",
            "delaySeconds": 0.02,
            "repeatMinSeconds": 0.0,
            "repeatMaxSeconds": 0.0,
            "stopOnTrigger": false,
            "accident": true,
            "overrideYaw": true,
            "yaw": 180.0
        },
        {
            "name": "事故車 2",
            "model": "Car_Left",
            "route": [
                {
                    "x": 34.58,
                    "z": 46.1
                },
                {
                    "x": 34.7,
                    "z": 34.73
                },
                {
                    "x": 36.72,
                    "z": 29.97
                },
                {
                    "x": 39.76,
                    "z": 28.35
                },
                {
                    "x": 42.49,
                    "z": 28.0
                },
                {
                    "x": 51.05,
                    "z": 28.0
                },
                {
                    "x": 80.51,
                    "z": 27.97
                },
                {
                    "x": 93.67,
                    "z": 17.92
                },
                {
                    "x": 94.36,
                    "z": 0.72
                }
            ],
            "speedKmh": 36.0,
            "start": "trigger",
            "delaySeconds": 3.52,
            "repeatMinSeconds": 0.0,
            "repeatMaxSeconds": 0.0,
            "stopOnTrigger": false,
            "accident": true,
            "overrideYaw": true,
            "yaw": 180.0
        }
    ]
}
