{
    "format": "vrlearn-scenario",
    "version": 1,
    "id": "builtin-03",
    "name": "道路の途中：左から続けて来る車",
    "nameEn": "Another car from the left",
    "setting": "midblock",
    "learningGoal": "1台通りすぎても、すぐ次の車が来ないか確かめる。",
    "situation": "止まっているトラックの横から渡ろうとしたとき、左から続けて来た車とぶつかりました。",
    "point": "1台通ったらもう一度左右を見て、次の車が来ないか確かめましょう。",
    "map": "hikone-kyobashi",
    "playerMode": "walking",
    "spawn": {
        "x": 69.53,
        "z": 19.0
    },
    "goal": {
        "x": 70.54,
        "z": 31.77,
        "width": 5.06,
        "depth": 1.0,
        "yaw": 0.0
    },
    "trigger": {
        "x": 69.55,
        "z": 25.75,
        "width": 2.53,
        "depth": 3.07,
        "yaw": 0.0
    },
    "vehicles": [
        {
            "name": "事故車 1",
            "model": "Car_Left",
            "route": [
                {
                    "x": 52.26,
                    "z": 27.9
                },
                {
                    "x": 62.1,
                    "z": 27.9
                },
                {
                    "x": 80.51,
                    "z": 27.97
                },
                {
                    "x": 93.67,
                    "z": 17.92
                },
                {
                    "x": 94.36,
                    "z": 0.72
                }
            ],
            "speedKmh": 36.0,
            "start": "trigger",
            "delaySeconds": 0.5,
            "repeatMinSeconds": 0.0,
            "repeatMaxSeconds": 0.0,
            "stopOnTrigger": false,
            "accident": true,
            "overrideYaw": true,
            "yaw": 90.0
        },
        {
            "name": "事故車 2",
            "model": "Car_Left",
            "route": [
                {
                    "x": 22.26,
                    "z": 27.9
                },
                {
                    "x": 62.1,
                    "z": 27.9
                },
                {
                    "x": 80.51,
                    "z": 27.97
                },
                {
                    "x": 93.67,
                    "z": 17.92
                },
                {
                    "x": 94.36,
                    "z": 0.72
                }
            ],
            "speedKmh": 36.0,
            "start": "trigger",
            "delaySeconds": 0.52,
            "repeatMinSeconds": 0.0,
            "repeatMaxSeconds": 0.0,
            "stopOnTrigger": false,
            "accident": true,
            "overrideYaw": true,
            "yaw": 90.0
        },
        {
            "name": "事故車 3",
            "model": "Car_Left",
            "route": [
                {
                    "x": 22.26,
                    "z": 27.9
                },
                {
                    "x": 62.1,
                    "z": 27.9
                },
                {
                    "x": 80.51,
                    "z": 27.97
                },
                {
                    "x": 93.67,
                    "z": 17.92
                },
                {
                    "x": 94.36,
                    "z": 0.72
                }
            ],
            "speedKmh": 36.0,
            "start": "trigger",
            "delaySeconds": 4.02,
            "repeatMinSeconds": 0.0,
            "repeatMaxSeconds": 0.0,
            "stopOnTrigger": false,
            "accident": true,
            "overrideYaw": true,
            "yaw": 90.0
        }
    ]
}
