{
    "format": "vrlearn-scenario",
    "version": 1,
    "id": "builtin-04",
    "name": "道路の途中：止まっている車の陰から来る車",
    "nameEn": "Car hidden by a truck",
    "setting": "midblock",
    "learningGoal": "止まっている車の陰は見えない。陰から出る前に止まって確かめる。",
    "situation": "止まっているトラックの陰から出たところで、右から来た車とぶつかりました。",
    "point": "車の陰から出るときは、いったん止まって顔を出し、右と左を確かめましょう。",
    "map": "hikone-kyobashi",
    "playerMode": "walking",
    "spawn": {
        "x": 62.62,
        "z": 19.0
    },
    "goal": {
        "x": 63.63,
        "z": 31.77,
        "width": 5.06,
        "depth": 1.0,
        "yaw": 0.0
    },
    "trigger": {
        "x": 62.64,
        "z": 25.75,
        "width": 2.53,
        "depth": 3.07,
        "yaw": 0.0
    },
    "vehicles": [
        {
            "name": "事故車 1",
            "model": "Car_Left",
            "route": [
                {
                    "x": 71.93,
                    "z": 26.25
                },
                {
                    "x": 69.88,
                    "z": 26.24
                },
                {
                    "x": 64.8,
                    "z": 26.41
                },
                {
                    "x": 51.95,
                    "z": 26.39
                },
                {
                    "x": 42.58,
                    "z": 24.19
                },
                {
                    "x": 24.22,
                    "z": 23.4
                },
                {
                    "x": 12.6,
                    "z": 15.69
                },
                {
                    "x": 12.11,
                    "z": 7.43
                }
            ],
            "speedKmh": 36.0,
            "start": "trigger",
            "delaySeconds": 0.5,
            "repeatMinSeconds": 0.0,
            "repeatMaxSeconds": 0.0,
            "stopOnTrigger": false,
            "accident": true,
            "overrideYaw": true,
            "yaw": -90.0
        },
        {
            "name": "事故車 2",
            "model": "Car_Left",
            "route": [
                {
                    "x": 71.93,
                    "z": 26.25
                },
                {
                    "x": 69.88,
                    "z": 26.24
                },
                {
                    "x": 64.8,
                    "z": 26.41
                },
                {
                    "x": 51.95,
                    "z": 26.39
                },
                {
                    "x": 42.58,
                    "z": 24.19
                },
                {
                    "x": 24.22,
                    "z": 23.4
                },
                {
                    "x": 12.6,
                    "z": 15.69
                },
                {
                    "x": 12.11,
                    "z": 7.43
                }
            ],
            "speedKmh": 36.0,
            "start": "trigger",
            "delaySeconds": 4.0,
            "repeatMinSeconds": 0.0,
            "repeatMaxSeconds": 0.0,
            "stopOnTrigger": false,
            "accident": true,
            "overrideYaw": true,
            "yaw": -90.0
        },
        {
            "name": "事故車 3",
            "model": "Car_Left",
            "route": [
                {
                    "x": 71.93,
                    "z": 26.25
                },
                {
                    "x": 69.88,
                    "z": 26.24
                },
                {
                    "x": 64.8,
                    "z": 26.41
                },
                {
                    "x": 51.95,
                    "z": 26.39
                },
                {
                    "x": 42.58,
                    "z": 24.19
                },
                {
                    "x": 24.22,
                    "z": 23.4
                },
                {
                    "x": 12.6,
                    "z": 15.69
                },
                {
                    "x": 12.11,
                    "z": 7.43
                }
            ],
            "speedKmh": 36.0,
            "start": "trigger",
            "delaySeconds": 11.0,
            "repeatMinSeconds": 0.0,
            "repeatMaxSeconds": 0.0,
            "stopOnTrigger": false,
            "accident": true,
            "overrideYaw": true,
            "yaw": -90.0
        }
    ]
}
